Kabupaten,Deskripsi,Provinsi,Ibu Kota,Bupati,Wakil Bupati,Luas Wilayah,Populasi Total,Populasi Kepadatan,Kode Area,Potensi Pariwisata,Potensi SDA,Kuliner Khas,Website Kabupaten,Attachments
KABUPATEN KEPULAUAN SERIBU,"Kabupaten Administrasi Kepulauan Seribu adalah sebuah kabupaten administrasi di Daerah Khusus Ibukota Jakarta, Indonesia. Wilayahnya meliputi gugusan kepulauan di Teluk Jakarta. Bupatinya saat ini adalah H. Budi Utomo, S.H, M.H. Sebelumnya wilayah Kepulauan Seribu merupakan salah satu kecamatan di Kota Administrasi Jakarta Utara.Pusat pemerintahan kabupaten ini terletak di Pulau Pramuka yang mulai difungsikan sebagai pusat pemerintahan kabupaten sejak tahun 2003. Terdapat dua Kecamatan di Kabupaten Administrasi Kepulauan Seribu yakni Kecamatan Kepulauan Seribu Selatan dan Kecamatan Kepulauan Seribu Utara. Kecamatan Kepulauan Seribu Selatan membawahi tiga kelurahan yaitu Kelurahan Pulau Tidung, Kelurahan Pulau Pari, dan Kelurahan Pulau Untung Jawa. Kecamatan Kepulauan Seribu Utara membawahi tiga kelurahan juga yaitu Kelurahan Pulau Kelapa, Kelurahan Pulau Harapan, dan Kelurahan Pulau Panggang.",DKI Jakarta,Pulau Pramuka,"H. Budi Utomo, S.H., M.H.",Muhammad Anwar,"11,8 km2",17.973 jiwa,"1.523,14 jiwa/km2",021,Pulau Kahyangan | Pulau Pabelokan | Pulau Bidadari | Pulau Onrust | Pulau Edam | Pulau Kotok,Pisang | Peternakan Kambing | Budidaya Ikan Laut,Celorot | Krupuk Cue | Geplak | Gegodo | Angsrut | Jepa | Belibar Manggis | Janda Mengandang | Bubur Ayak | Kue Abuk | Bebodor | Kue Intil | Podeng | Talam Belondo | Apem Moher | Maco | Kelepon | Lempeng Ketan | Kue Precet | Gengsot | Sengkolun | Gulali Beko | Lontrong | Rangi | Misro | Combro | Bacang | Kue Bangkit | Putu Mayang | Lempeng | Uler Bulu | Sagon | Ketimus | Kue Koci | Es Kemong | Gegemblong | Ciluk | Putu Ayu | Putu Mayang | Arisol | Ketan Srikaya | Apem Cukit | Apem Putih | Bujang Gemuk | Kue Ladu | Selendang Mayang | Orok-Orok | Kletus,http://pulauseribu.jakarta.go.id,"bupati.jpg (https://dl.airtable.com/PUbqKNTaR5SkoSmpOUq1_bupati.jpg),logo.jpg (https://dl.airtable.com/D0cFPMqAQmMKZ9gUUfzg_logo.jpg),wakil-bupati.jpg (https://dl.airtable.com/0ycO3agRgeiPhkWLr4ow_wakil-bupati.jpg),map.jpg (https://dl.airtable.com/9IuQUpIRnCeDzXiFFYbn_map.jpg)"
KOTA JAKARTA BARAT,Jakarta Barat adalah salah satu dari 5 kota administrasi di Daerah Khusus Ibukota Jakarta. Jakarta Barat secara administratif terbagi menjadi 8 kecamatan dan 56 kelurahan.,DKI Jakarta,Kembangan,"H. M. Anas Effendi, S.H, M.M",M Yuliadi,"127,11 km2",2.260.341 jiwa (2011),"17.782,56 jiwa/km2",021,Museum Seni Rupa dan Keramik | Toko Merah | Museum Wayang,Garmen tekstil | Mabel kayu,Asinan Betawi | Ayam Sampyok | Bir Pletok,http://barat.jakarta.go.id/,"map.jpg (https://dl.airtable.com/niT8LsCxQ1GIBy4KH0Uw_map.jpg),wakil-bupati.jpg (https://dl.airtable.com/mKlOhFhSnamvIfBNuRTw_wakil-bupati.jpg),logo.jpg (https://dl.airtable.com/H09TjCoQKkBmFYV7hlZA_logo.jpg),bupati.jpg (https://dl.airtable.com/tVJeYFhzRpKQxufU1TdF_bupati.jpg)"
KOTA JAKARTA PUSAT,"Kota Administrasi Jakarta Pusat adalah nama sebuah kota administrasi di pusat Daerah Khusus Ibukota Jakarta. Pusat Pemerintahannya berada Menteng. Di sebelah utara Jakarta Pusat berbatasan dengan Jakarta Utara, di sebelah timur dengan Jakarta Timur, di sebelah selatan dengan Jakarta Selatan dan di sebelah barat dengan Jakarta Barat. Jakarta Pusat adalah administrasi terkecil Provinsi DKI Jakarta. Pada zaman Hindia Belanda disebut Batavia Centrum.",DKI Jakarta,Menteng,Mangara Pardede,"Drs. Arifin, M.AP","50,2 km2",861.531 jiwa (2005),"17.161,97 jiwa/km2",021,Monumen Nasional | Masjid Istiqlal | Gereja Katedral | Pasar Baru | Museum Gajah | Taman Ismail Marzuki,,Roti Buaya | Dodol | Bir pletok,http://pusat.jakarta.go.id/,"map.jpg (https://dl.airtable.com/aMTkeC8TUehcMbLz2aNw_map.jpg),bupati.jpg (https://dl.airtable.com/mXcZBy8oTI2Z9XgZn2R2_bupati.jpg),logo.jpg (https://dl.airtable.com/SlnvP0ERRjODfrpLWXZj_logo.jpg),wakil-bupati.png (https://dl.airtable.com/ruGMmYaT6KYbXYnc1LDJ_wakil-bupati.png)"
KOTA JAKARTA SELATAN,"Jakarta Selatan adalah nama sebuah kota administrasi di bagian selatan Daerah Khusus Ibukota Jakarta. Jakarta Selatan adalah salah satu dari lima kota administrasi dan satu kabupaten administrasi DKI. Di sebelah utara, Jakarta Selatan berbatasan dengan Jakarta Barat dan Jakarta Pusat. Di sebelah timur berbatasan dengan Jakarta Timur. Di sebelah selatan berbatasan dengan Kota Depok, dan sebelah barat dengan Kota Tangerang dan Kota Tangerang Selatan.",DKI Jakarta,Kebayoran Baru,"Tri Kurniadi, SH, M.Si","Drs. Irmansyah, M.Sc","141,27 km2",2.057.080 jiwa (2010),"14.561,34 jiwa/km2",021,Kebun Binatang Ragunan | Setu Babakan | Museum Satria Mandala | Museum Layang-layang,,Ketoprak | Kerak Telur | Asinan Betawi,http://selatan.jakarta.go.id/,"bupati.jpg (https://dl.airtable.com/rDA8IRKRruveZtrwZRag_bupati.jpg),map.jpg (https://dl.airtable.com/cx4QR4idSISWAH9AhcRK_map.jpg),logo.jpg (https://dl.airtable.com/r4eOTtgSRaq6fZ0KBOSN_logo.jpg),wakil-bupati.jpg (https://dl.airtable.com/QJs2EnNxQxC6NY5Wtgap_wakil-bupati.jpg)"
KOTA JAKARTA TIMUR,"Jakarta Timur adalah nama sebuah kota administrasi di bagian timur Daerah Khusus Ibukota Jakarta. Di sebelah utara, ia berbatasan dengan kota administrasi Jakarta Utara dan Jakarta Pusat. Sedangkan di sebelah timur, ia berbatasan dengan Bekasi. Kota ini, di bagian selatan, berbatasan dengan Kota Depok. Dan di sebelah barat, ia berbatasan dengan kota administrasi Jakarta Selatan.",DKI Jakarta,Cakung,"Drs. H. Bambang Musyawardhana, M.M","Drs. H. Husein Murad, M.Si","187,75 km2",2.693.896 jiwa (2010),"14.348,31 jiwa/km2",021,Taman Mini Indonesia Indah | Telaga Arwana Cibubur | Bumi Perkemahan dan Graha Wisata Cibubur,,Kue Cucur | Kue Bika Ambon | Kue Ale-Ale | Kue Rangi Betawi,http://timur.jakarta.go.id/,"bupati.jpg (https://dl.airtable.com/wPspe5xQNuFOsw8Yuw0q_bupati.jpg),wakil-bupati.jpg (https://dl.airtable.com/79GtGwmQwO4MOdF0lXwD_wakil-bupati.jpg),map.jpg (https://dl.airtable.com/ouhYgqihR1mdHOni2LXD_map.jpg),logo.jpg (https://dl.airtable.com/5TxZWDRIRsC1R0Ykq41m_logo.jpg)"
KOTA JAKARTA UTARA,"Kota Administrasi Jakarta Utara adalah nama sebuah kota administrasi di bagian utara Daerah Khusus Ibukota Jakarta. Pusat Pemerintahannya berada di Koja. Di sebelah utara Jakarta Utara berbatasan dengan Laut Jawa, di sebelah timur dengan Bekasi, di sebelah selatan dengan Jakarta Barat, Jakarta Pusat dan Jakarta Timur. Di sebelah barat Jakarta Utara berbatasan dengan Tangerang.",DKI Jakarta,Jakarta Utara,Wahyu Haryadi,,137 km2,1.468.840 jiwa (2005),"10.721,46 jiwa/km2",021,Jakarta Islamic Center | Taman Impian Jaya Ancol | Taman Suaka Margasatwa Muara Angke | Kampung Marunda | Kawasan Pelabuhan Sunda Kelapa | Museum Bahari,,Kue Geplak | Dodol | Kerak Telor Betawi | Gado-Gado,http://utara.jakarta.go.id/,"map.jpg (https://dl.airtable.com/6YUdtuERiCHHiFsRxZ1i_map.jpg),bupati.jpg (https://dl.airtable.com/KMF25pXTF6ATgxbpea7q_bupati.jpg),logo.jpg (https://dl.airtable.com/JSzfp3U5QvG4KAdgF5TC_logo.jpg)"